{
  "correlations": {
    "draft_percentile_finish_score": -0.0851876466882841,
    "draft_percentile_points_z": -0.07564009909346463,
    "pick_finish": 0.09098096327889316
  },
  "generated_at": "2026-07-16T00:00:00Z",
  "generator_version": 1,
  "owner_recommendations": [
    {
      "best_pick": {
        "avg_finish": 2.0,
        "avg_finish_score": 0.8571428571428571,
        "draft_pick": 1,
        "label": "Pick 1",
        "n": 1,
        "playoffs": 1,
        "saunders": 0,
        "titles": 0,
        "top_three": 1
      },
      "best_zone": {
        "avg_finish": 2.0,
        "avg_finish_score": 0.8571428571428571,
        "label": "Early (1-3)",
        "n": 1,
        "playoffs": 1,
        "saunders": 0,
        "titles": 0,
        "top_three": 1,
        "zone": "Early (1-3)",
        "zone_key": "early"
      },
      "caution": "Weakest area: Middle (4-7) (avg finish 4.0, n=1). Sample is too small for a firm owner-specific read.",
      "confidence": "small",
      "history": [
        {
          "champion": false,
          "draft_pick": 1,
          "finish": 2,
          "made_playoffs": true,
          "saunders": false,
          "season": 2020
        },
        {
          "champion": false,
          "draft_pick": 6,
          "finish": 4,
          "made_playoffs": true,
          "saunders": false,
          "season": 2021
        }
      ],
      "owner": "Chuck",
      "recommendation": "Target Early (1-3). It is this owner's best observed zone: avg finish 2.0, playoffs 1/1, titles 0.",
      "target": "Early (1-3)"
    },
    {
      "best_pick": {
        "avg_finish": 1.0,
        "avg_finish_score": 1.0,
        "draft_pick": 2,
        "label": "Pick 2",
        "n": 1,
        "playoffs": 1,
        "saunders": 0,
        "titles": 1,
        "top_three": 1
      },
      "best_zone": {
        "avg_finish": 1.0,
        "avg_finish_score": 1.0,
        "label": "Early (1-3)",
        "n": 1,
        "playoffs": 1,
        "saunders": 0,
        "titles": 1,
        "top_three": 1,
        "zone": "Early (1-3)",
        "zone_key": "early"
      },
      "caution": "Weakest area: Middle (4-7) (avg finish 7.5, n=2).",
      "confidence": "strong",
      "history": [
        {
          "champion": false,
          "draft_pick": 5,
          "finish": 6,
          "made_playoffs": false,
          "saunders": false,
          "season": 2020
        },
        {
          "champion": false,
          "draft_pick": 8,
          "finish": 7,
          "made_playoffs": false,
          "saunders": false,
          "season": 2021
        },
        {
          "champion": false,
          "draft_pick": 12,
          "finish": 6,
          "made_playoffs": true,
          "saunders": false,
          "season": 2022
        },
        {
          "champion": false,
          "draft_pick": 5,
          "finish": 9,
          "made_playoffs": false,
          "saunders": false,
          "season": 2023
        },
        {
          "champion": false,
          "draft_pick": 12,
          "finish": 3,
          "made_playoffs": true,
          "saunders": false,
          "season": 2024
        },
        {
          "champion": true,
          "draft_pick": 2,
          "finish": 1,
          "made_playoffs": true,
          "saunders": false,
          "season": 2025
        }
      ],
      "owner": "Dulberger",
      "recommendation": "Best single result is Pick 2, but the sturdier area is Late (8+) (avg finish 5.3, n=3).",
      "target": "Pick 2 upside; Late (8+) repeat zone"
    },
    {
      "best_pick": {
        "avg_finish": 7.0,
        "avg_finish_score": 0.45454545454545453,
        "draft_pick": 6,
        "label": "Pick 6",
        "n": 1,
        "playoffs": 0,
        "saunders": 0,
        "titles": 0,
        "top_three": 0
      },
      "best_zone": {
        "avg_finish": 8.25,
        "avg_finish_score": 0.3409090909090909,
        "label": "Middle (4-7)",
        "n": 4,
        "playoffs": 0,
        "saunders": 1,
        "titles": 0,
        "top_three": 0,
        "zone": "Middle (4-7)",
        "zone_key": "middle"
      },
      "caution": "No clear avoid zone yet.",
      "confidence": "medium",
      "history": [
        {
          "champion": false,
          "draft_pick": 4,
          "finish": 12,
          "made_playoffs": false,
          "saunders": true,
          "season": 2022
        },
        {
          "champion": false,
          "draft_pick": 4,
          "finish": 7,
          "made_playoffs": false,
          "saunders": false,
          "season": 2023
        },
        {
          "champion": false,
          "draft_pick": 4,
          "finish": 7,
          "made_playoffs": false,
          "saunders": false,
          "season": 2024
        },
        {
          "champion": false,
          "draft_pick": 6,
          "finish": 7,
          "made_playoffs": false,
          "saunders": false,
          "season": 2025
        }
      ],
      "owner": "Erin",
      "recommendation": "Best single result is Pick 6, but the sturdier area is Middle (4-7) (avg finish 8.2, n=4).",
      "target": "Pick 6 upside; Middle (4-7) repeat zone"
    },
    {
      "best_pick": {
        "avg_finish": 2.0,
        "avg_finish_score": 0.9090909090909092,
        "draft_pick": 2,
        "label": "Pick 2",
        "n": 2,
        "playoffs": 2,
        "saunders": 0,
        "titles": 1,
        "top_three": 2
      },
      "best_zone": {
        "avg_finish": 2.0,
        "avg_finish_score": 0.9090909090909092,
        "label": "Early (1-3)",
        "n": 2,
        "playoffs": 2,
        "saunders": 0,
        "titles": 1,
        "top_three": 2,
        "zone": "Early (1-3)",
        "zone_key": "early"
      },
      "caution": "Weakest area: Middle (4-7) (avg finish 6.0, n=2).",
      "confidence": "medium",
      "history": [
        {
          "champion": false,
          "draft_pick": 2,
          "finish": 3,
          "made_playoffs": true,
          "saunders": false,
          "season": 2022
        },
        {
          "champion": true,
          "draft_pick": 2,
          "finish": 1,
          "made_playoffs": true,
          "saunders": false,
          "season": 2023
        },
        {
          "champion": false,
          "draft_pick": 5,
          "finish": 6,
          "made_playoffs": true,
          "saunders": false,
          "season": 2024
        },
        {
          "champion": false,
          "draft_pick": 4,
          "finish": 6,
          "made_playoffs": true,
          "saunders": false,
          "season": 2025
        }
      ],
      "owner": "Joe",
      "recommendation": "Target Early (1-3). It is this owner's best observed zone: avg finish 2.0, playoffs 2/2, titles 1.",
      "target": "Early (1-3)"
    },
    {
      "best_pick": {
        "avg_finish": 6.0,
        "avg_finish_score": 0.4444444444444444,
        "draft_pick": 10,
        "label": "Pick 10",
        "n": 1,
        "playoffs": 1,
        "saunders": 0,
        "titles": 0,
        "top_three": 0
      },
      "best_zone": {
        "avg_finish": 6.0,
        "avg_finish_score": 0.4444444444444444,
        "label": "Late (8+)",
        "n": 1,
        "playoffs": 1,
        "saunders": 0,
        "titles": 0,
        "top_three": 0,
        "zone": "Late (8+)",
        "zone_key": "late"
      },
      "caution": "No clear avoid zone yet. Sample is too small for a firm owner-specific read.",
      "confidence": "league-wide fallback",
      "history": [
        {
          "champion": false,
          "draft_pick": 10,
          "finish": 6,
          "made_playoffs": true,
          "saunders": false,
          "season": 2021
        }
      ],
      "owner": "Julia",
      "recommendation": "Only one owner-specific sample: pick 10 in 2021, finish 6. Use league-wide history first; pick 2 has the best observed finish score.",
      "target": "League-wide fallback: pick 2"
    },
    {
      "best_pick": {
        "avg_finish": 4.0,
        "avg_finish_score": 0.7272727272727273,
        "draft_pick": 1,
        "label": "Pick 1",
        "n": 2,
        "playoffs": 2,
        "saunders": 0,
        "titles": 0,
        "top_three": 1
      },
      "best_zone": {
        "avg_finish": 4.0,
        "avg_finish_score": 0.7272727272727273,
        "label": "Early (1-3)",
        "n": 2,
        "playoffs": 2,
        "saunders": 0,
        "titles": 0,
        "top_three": 1,
        "zone": "Early (1-3)",
        "zone_key": "early"
      },
      "caution": "Weakest area: Late (8+) (avg finish 6.5, n=2).",
      "confidence": "medium",
      "history": [
        {
          "champion": false,
          "draft_pick": 11,
          "finish": 9,
          "made_playoffs": false,
          "saunders": false,
          "season": 2022
        },
        {
          "champion": false,
          "draft_pick": 1,
          "finish": 3,
          "made_playoffs": true,
          "saunders": false,
          "season": 2023
        },
        {
          "champion": false,
          "draft_pick": 1,
          "finish": 5,
          "made_playoffs": true,
          "saunders": false,
          "season": 2024
        },
        {
          "champion": false,
          "draft_pick": 11,
          "finish": 4,
          "made_playoffs": true,
          "saunders": false,
          "season": 2025
        }
      ],
      "owner": "Kylie",
      "recommendation": "Target Early (1-3). It is this owner's best observed zone: avg finish 4.0, playoffs 2/2, titles 0.",
      "target": "Early (1-3)"
    },
    {
      "best_pick": {
        "avg_finish": 1.0,
        "avg_finish_score": 1.0,
        "draft_pick": 2,
        "label": "Pick 2",
        "n": 1,
        "playoffs": 1,
        "saunders": 0,
        "titles": 1,
        "top_three": 1
      },
      "best_zone": {
        "avg_finish": 5.5,